{"bounds":{"max_steps":16},"expected_outcome":"exhausted","kind":"formal-execution-expectation","model":{"config_sha256":"dddddddddddddddddddddddddddddddddddddddddddddddddddddddddddddddd","id":"MODEL-DEMO","language":"tla-plus","operations":["begin"],"source_sha256":"cccccccccccccccccccccccccccccccccccccccccccccccccccccccccccccccc","states":["ready"]},"run":{"argv_sha256":"1111111111111111111111111111111111111111111111111111111111111111","attempt":1,"id":"RUN-DEMO"},"schema_version":1,"sensitivity":{"bounds_sha256":"f2d438ef3265bf1e3cacd49ab9ccc0577006d767fb6a298be71b57bddaaecd29","config_sha256":"4444444444444444444444444444444444444444444444444444444444444444","counterexample_sha256":"5555555555555555555555555555555555555555555555555555555555555555","expected_outcome":"counterexample","model_sha256":"3333333333333333333333333333333333333333333333333333333333333333","mutation_id":"MUTATION-DEMO","mutation_sha256":"6666666666666666666666666666666666666666666666666666666666666666","observed_outcome":"counterexample","result_sha256":"7777777777777777777777777777777777777777777777777777777777777777","run_sha256":"c1906cb47192a896d4a46fddbaab335d378047cea369e81827334ad34345a751","tool_sha256":"c8c56cabc7065d7e7af634aeafda3aa11d7f05d48e893c0ef5fc8e46639094aa"},"source":{"commit":"aaaaaaaaaaaaaaaaaaaaaaaaaaaaaaaaaaaaaaaa","tree":"bbbbbbbbbbbbbbbbbbbbbbbbbbbbbbbbbbbbbbbb"},"tool":{"adapter_id":"ADAPTER-FORMAL-MODEL-TLC","executable_sha256":"eeeeeeeeeeeeeeeeeeeeeeeeeeeeeeeeeeeeeeeeeeeeeeeeeeeeeeeeeeeeeeee","name":"tlc","version":"1.8.0"}}
